

1	0.000000000	192.168.9.128	192.168.9.2	DNS	79	Standard query 0xdf04 A accounts.google.com
2	0.040746675	192.168.9.128	239.255.255.250	SSDP	209	M-SEARCH * HTTP/1.1 
3	0.075986677	192.168.9.128	192.168.9.2	DNS	74	Standard query 0x1444 A www.google.com
4	0.078789589	192.168.9.2	192.168.9.128	DNS	90	Standard query response 0x1444 A www.google.com A 216.239.38.120
5	0.079955428	192.168.9.128	216.239.38.120	TCP	74	41722 → 443 [SYN] Seq=0 Win=64240 Len=0 MSS=1460 SACK_PERM TSval=3831329654 TSecr=0 WS=128
6	0.177849440	216.239.38.120	192.168.9.128	TCP	60	443 → 41722 [SYN, ACK] Seq=0 Ack=1 Win=64240 Len=0 MSS=1460
7	0.177975798	192.168.9.128	216.239.38.120	TCP	54	41722 → 443 [ACK] Seq=1 Ack=1 Win=64240 Len=0
8	0.178044461	192.168.9.2	192.168.9.128	DNS	95	Standard query response 0xdf04 A accounts.google.com A 142.251.5.84
9	0.178480317	192.168.9.128	216.239.38.120	TLSv1.3	571	Client Hello (SNI=www.google.com)
10	0.178888826	216.239.38.120	192.168.9.128	TCP	60	443 → 41722 [ACK] Seq=1 Ack=518 Win=64240 Len=0
11	0.178977810	192.168.9.128	142.251.5.84	TCP	74	34818 → 443 [SYN] Seq=0 Win=64240 Len=0 MSS=1460 SACK_PERM TSval=1158730248 TSecr=0 WS=128
12	0.253542541	192.168.9.128	142.251.5.84	TCP	74	34824 → 443 [SYN] Seq=0 Win=64240 Len=0 MSS=1460 SACK_PERM TSval=1158730322 TSecr=0 WS=128
13	0.268423488	142.251.5.84	192.168.9.128	TCP	60	443 → 34818 [SYN, ACK] Seq=0 Ack=1 Win=64240 Len=0 MSS=1460
14	0.268490061	192.168.9.128	142.251.5.84	TCP	54	34818 → 443 [ACK] Seq=1 Ack=1 Win=64240 Len=0
15	0.268774260	192.168.9.128	142.251.5.84	TLSv1.3	571	Client Hello (SNI=accounts.google.com)
16	0.268967164	142.251.5.84	192.168.9.128	TCP	60	443 → 34818 [ACK] Seq=1 Ack=518 Win=64240 Len=0
17	0.318075113	142.251.5.84	192.168.9.128	TCP	60	443 → 34824 [SYN, ACK] Seq=0 Ack=1 Win=64240 Len=0 MSS=1460
18	0.318134974	192.168.9.128	142.251.5.84	TCP	54	34824 → 443 [ACK] Seq=1 Ack=1 Win=64240 Len=0
19	0.318554662	192.168.9.128	142.251.5.84	TLSv1.3	571	Client Hello (SNI=accounts.google.com)
20	0.318869003	142.251.5.84	192.168.9.128	TCP	60	443 → 34824 [ACK] Seq=1 Ack=518 Win=64240 Len=0
21	0.390405065	216.239.38.120	192.168.9.128	TLSv1.3	1442	Server Hello, Change Cipher Spec
22	0.390446271	192.168.9.128	216.239.38.120	TCP	54	41722 → 443 [ACK] Seq=518 Ack=1389 Win=63848 Len=0
23	0.391484629	216.239.38.120	192.168.9.128	TCP	1454	443 → 41722 [PSH, ACK] Seq=1389 Ack=518 Win=64240 Len=1400 [TCP PDU reassembled in 27]
24	0.391540219	192.168.9.128	216.239.38.120	TCP	54	41722 → 443 [ACK] Seq=518 Ack=2789 Win=63848 Len=0
25	0.391623773	216.239.38.120	192.168.9.128	TCP	1514	443 → 41722 [ACK] Seq=2789 Ack=518 Win=64240 Len=1460 [TCP PDU reassembled in 27]
26	0.391643300	192.168.9.128	216.239.38.120	TCP	54	41722 → 443 [ACK] Seq=518 Ack=4249 Win=62780 Len=0
27	0.391679438	216.239.38.120	192.168.9.128	TLSv1.3	68	Application Data
28	0.391687543	192.168.9.128	216.239.38.120	TCP	54	41722 → 443 [ACK] Seq=518 Ack=4263 Win=62780 Len=0
29	0.413974927	192.168.9.128	216.239.38.120	TLSv1.3	128	Change Cipher Spec, Application Data
30	0.414279969	216.239.38.120	192.168.9.128	TCP	60	443 → 41722 [ACK] Seq=4263 Ack=592 Win=64240 Len=0
31	0.415113510	192.168.9.128	216.239.38.120	TLSv1.3	152	Application Data
32	0.415378975	216.239.38.120	192.168.9.128	TCP	60	443 → 41722 [ACK] Seq=4263 Ack=690 Win=64240 Len=0
33	0.416008919	192.168.9.128	216.239.38.120	TLSv1.3	870	Application Data
34	0.416426703	216.239.38.120	192.168.9.128	TCP	60	443 → 41722 [ACK] Seq=4263 Ack=1506 Win=64240 Len=0
35	0.416458276	192.168.9.128	216.239.38.120	TLSv1.3	210	Application Data, Application Data
36	0.416954233	216.239.38.120	192.168.9.128	TCP	60	443 → 41722 [ACK] Seq=4263 Ack=1662 Win=64240 Len=0
37	0.454288718	192.168.9.128	216.239.38.120	TLSv1.3	117	Application Data
38	0.454659145	216.239.38.120	192.168.9.128	TCP	60	443 → 41722 [ACK] Seq=4263 Ack=1725 Win=64240 Len=0
39	0.491778844	142.251.5.84	192.168.9.128	TLSv1.3	1454	Server Hello, Change Cipher Spec
40	0.492536928	192.168.9.128	142.251.5.84	TCP	54	34818 → 443 [ACK] Seq=518 Ack=1401 Win=63000 Len=0
41	0.493215217	142.251.5.84	192.168.9.128	TCP	1514	443 → 34818 [ACK] Seq=1401 Ack=518 Win=64240 Len=1460 [TCP PDU reassembled in 43]
42	0.493436271	192.168.9.128	142.251.5.84	TCP	54	34818 → 443 [ACK] Seq=518 Ack=2861 Win=63000 Len=0
43	0.493818879	142.251.5.84	192.168.9.128	TLSv1.3	192	Application Data
44	0.494198283	192.168.9.128	142.251.5.84	TCP	54	34818 → 443 [ACK] Seq=518 Ack=2999 Win=63000 Len=0
45	0.513786567	192.168.9.128	142.251.5.84	TLSv1.3	128	Change Cipher Spec, Application Data
46	0.514049019	142.251.5.84	192.168.9.128	TCP	60	443 → 34818 [ACK] Seq=2999 Ack=592 Win=64240 Len=0
47	0.514311213	192.168.9.128	142.251.5.84	TLSv1.3	152	Application Data
48	0.514665108	142.251.5.84	192.168.9.128	TCP	60	443 → 34818 [ACK] Seq=2999 Ack=690 Win=64240 Len=0
49	0.514713488	192.168.9.128	142.251.5.84	TLSv1.3	812	Application Data
50	0.516233363	142.251.5.84	192.168.9.128	TCP	60	443 → 34818 [ACK] Seq=2999 Ack=1448 Win=64240 Len=0
51	0.517226154	192.168.9.128	142.251.5.84	TLSv1.3	86	Application Data
52	0.517418088	142.251.5.84	192.168.9.128	TCP	60	443 → 34818 [ACK] Seq=2999 Ack=1480 Win=64240 Len=0
53	0.520100063	216.239.38.120	192.168.9.128	TLSv1.3	1010	Application Data, Application Data
54	0.520363298	192.168.9.128	216.239.38.120	TCP	54	41722 → 443 [ACK] Seq=1725 Ack=5219 Win=62780 Len=0
55	0.520764669	216.239.38.120	192.168.9.128	TLSv1.3	85	Application Data
56	0.521090843	192.168.9.128	216.239.38.120	TCP	54	41722 → 443 [ACK] Seq=1725 Ack=5250 Win=62780 Len=0
57	0.529088981	192.168.9.128	216.239.38.120	TLSv1.3	85	Application Data
58	0.529509294	216.239.38.120	192.168.9.128	TCP	60	443 → 41722 [ACK] Seq=5250 Ack=1756 Win=64240 Len=0
59	0.536871952	142.251.5.84	192.168.9.128	TLSv1.3	1454	Server Hello, Change Cipher Spec
60	0.536903815	192.168.9.128	142.251.5.84	TCP	54	34824 → 443 [ACK] Seq=518 Ack=1401 Win=63000 Len=0
61	0.538095315	142.251.5.84	192.168.9.128	TCP	1514	443 → 34824 [ACK] Seq=1401 Ack=518 Win=64240 Len=1460 [TCP PDU reassembled in 63]
62	0.538123477	192.168.9.128	142.251.5.84	TCP	54	34824 → 443 [ACK] Seq=518 Ack=2861 Win=63000 Len=0
63	0.538250871	142.251.5.84	192.168.9.128	TLSv1.3	193	Application Data
64	0.538267614	192.168.9.128	142.251.5.84	TCP	54	34824 → 443 [ACK] Seq=518 Ack=3000 Win=63000 Len=0
65	0.539081186	192.168.9.128	142.251.5.84	TLSv1.3	128	Change Cipher Spec, Application Data
66	0.539520249	142.251.5.84	192.168.9.128	TCP	60	443 → 34824 [ACK] Seq=3000 Ack=592 Win=64240 Len=0
67	0.649057833	216.239.38.120	192.168.9.128	TLSv1.3	1068	Application Data, Application Data, Application Data, Application Data, Application Data
68	0.649103474	192.168.9.128	216.239.38.120	TCP	54	41722 → 443 [ACK] Seq=1756 Ack=6264 Win=62780 Len=0
69	0.649980482	142.251.5.84	192.168.9.128	TLSv1.3	1020	Application Data, Application Data
70	0.650014358	192.168.9.128	142.251.5.84	TCP	54	34818 → 443 [ACK] Seq=1480 Ack=3965 Win=63000 Len=0
71	0.658371102	216.239.38.120	192.168.9.128	TLSv1.3	376	Application Data, Application Data, Application Data
72	0.658423378	192.168.9.128	216.239.38.120	TCP	54	41722 → 443 [ACK] Seq=1756 Ack=6586 Win=62780 Len=0
73	0.658469958	142.251.5.84	192.168.9.128	TLSv1.3	1020	Application Data, Application Data
74	0.658477173	192.168.9.128	142.251.5.84	TCP	54	34824 → 443 [ACK] Seq=592 Ack=3966 Win=63000 Len=0
75	0.661461829	192.168.9.128	216.239.38.120	TLSv1.3	93	Application Data
76	0.661651114	192.168.9.128	142.251.5.84	TLSv1.3	85	Application Data
77	0.661886957	216.239.38.120	192.168.9.128	TCP	60	443 → 41722 [ACK] Seq=6586 Ack=1795 Win=64240 Len=0
78	0.661915546	142.251.5.84	192.168.9.128	TCP	60	443 → 34818 [ACK] Seq=3965 Ack=1511 Win=64240 Len=0
79	0.673187638	216.239.38.120	192.168.9.128	TLSv1.3	1454	Application Data
80	0.675738288	216.239.38.120	192.168.9.128	TLSv1.3	1430	Application Data
81	0.675896205	192.168.9.128	216.239.38.120	TCP	54	41722 → 443 [ACK] Seq=1795 Ack=9362 Win=62780 Len=0
82	0.675967750	216.239.38.120	192.168.9.128	TLSv1.3	1442	Application Data
83	0.676981204	216.239.38.120	192.168.9.128	TLSv1.3	1454	Application Data
84	0.676995857	216.239.38.120	192.168.9.128	TLSv1.3	1514	Application Data, Application Data, Application Data
85	0.677002346	216.239.38.120	192.168.9.128	TLSv1.3	555	Application Data
86	0.677223262	192.168.9.128	216.239.38.120	TCP	54	41722 → 443 [ACK] Seq=1795 Ack=14111 Win=62780 Len=0
87	0.678587730	216.239.38.120	192.168.9.128	TLSv1.3	1454	Application Data
88	0.682089270	216.239.38.120	192.168.9.128	TLSv1.3	1514	Application Data
89	0.682115240	192.168.9.128	216.239.38.120	TCP	54	41722 → 443 [ACK] Seq=1795 Ack=16971 Win=62780 Len=0
90	0.682241177	216.239.38.120	192.168.9.128	TLSv1.3	1514	Application Data
91	0.682256063	216.239.38.120	192.168.9.128	TLSv1.3	1286	Application Data
92	0.682262672	216.239.38.120	192.168.9.128	TLSv1.3	1514	Application Data
93	0.682267537	216.239.38.120	192.168.9.128	TLSv1.3	1370	Application Data
94	0.682272338	216.239.38.120	192.168.9.128	TLSv1.3	1454	Application Data
95	0.682316674	192.168.9.128	216.239.38.120	TCP	54	41722 → 443 [ACK] Seq=1795 Ack=23839 Win=62780 Len=0
96	0.684859231	216.239.38.120	192.168.9.128	TLSv1.3	1430	Application Data
97	0.684955105	142.251.5.84	192.168.9.128	TLSv1.3	85	Application Data
98	0.684990036	192.168.9.128	142.251.5.84	TCP	54	34818 → 443 [ACK] Seq=1511 Ack=3996 Win=63000 Len=0
99	0.689153003	142.251.5.84	192.168.9.128	TLSv1.3	1454	Application Data, Application Data
100	0.689208674	192.168.9.128	142.251.5.84	TCP	54	34818 → 443 [ACK] Seq=1511 Ack=5396 Win=63000 Len=0
101	0.690016795	142.251.5.84	192.168.9.128	TLSv1.3	299	Application Data, Application Data, Application Data
102	0.690025141	192.168.9.128	142.251.5.84	TCP	54	34818 → 443 [ACK] Seq=1511 Ack=5641 Win=63000 Len=0
103	0.693517893	192.168.9.128	142.251.5.84	TLSv1.3	93	Application Data
104	0.693885691	142.251.5.84	192.168.9.128	TCP	60	443 → 34818 [ACK] Seq=5641 Ack=1550 Win=64240 Len=0
105	0.706660520	216.239.38.120	192.168.9.128	TLSv1.3	1454	Application Data
106	0.706705040	192.168.9.128	216.239.38.120	TCP	54	41722 → 443 [ACK] Seq=1795 Ack=26615 Win=62780 Len=0
107	0.706827685	216.239.38.120	192.168.9.128	TLSv1.3	1454	Application Data
108	0.716166449	216.239.38.120	192.168.9.128	TLSv1.3	1454	Application Data, Application Data
109	0.716209223	192.168.9.128	216.239.38.120	TCP	54	41722 → 443 [ACK] Seq=1795 Ack=29415 Win=62780 Len=0
110	0.717391456	216.239.38.120	192.168.9.128	TLSv1.3	1454	Application Data
111	0.717980980	216.239.38.120	192.168.9.128	TLSv1.3	1514	Application Data
112	0.718009762	192.168.9.128	216.239.38.120	TCP	54	41722 → 443 [ACK] Seq=1795 Ack=32275 Win=62780 Len=0
113	0.718088743	216.239.38.120	192.168.9.128	TLSv1.3	1394	Application Data
114	0.720515220	216.239.38.120	192.168.9.128	TLSv1.3	1454	Application Data
115	0.720540281	192.168.9.128	216.239.38.120	TCP	54	41722 → 443 [ACK] Seq=1795 Ack=35015 Win=62780 Len=0
116	0.721126738	216.239.38.120	192.168.9.128	TLSv1.3	1514	Application Data
117	0.721166553	216.239.38.120	192.168.9.128	TLSv1.3	1394	Application Data
118	0.721174820	192.168.9.128	216.239.38.120	TCP	54	41722 → 443 [ACK] Seq=1795 Ack=37815 Win=62780 Len=0
119	0.723824124	216.239.38.120	192.168.9.128	TLSv1.3	1514	Application Data
120	0.723861733	216.239.38.120	192.168.9.128	TLSv1.3	1514	Application Data
121	0.723868765	192.168.9.128	216.239.38.120	TCP	54	41722 → 443 [ACK] Seq=1795 Ack=40735 Win=62780 Len=0
122	0.723904797	216.239.38.120	192.168.9.128	TLSv1.3	1334	Application Data
123	0.725391872	216.239.38.120	192.168.9.128	TLSv1.3	1454	Application Data
124	0.725412569	192.168.9.128	216.239.38.120	TCP	54	41722 → 443 [ACK] Seq=1795 Ack=43415 Win=62780 Len=0
125	0.726650482	216.239.38.120	192.168.9.128	TLSv1.3	1424	Application Data, Application Data, Application Data, Application Data, Application Data
126	0.768350039	192.168.9.128	216.239.38.120	TCP	54	41722 → 443 [ACK] Seq=1795 Ack=44785 Win=62780 Len=0
127	0.971132232	192.168.9.128	192.168.9.2	DNS	83	Standard query 0x7f13 A ogads-pa.googleapis.com
128	1.022736326	192.168.9.2	192.168.9.128	DNS	339	Standard query response 0x7f13 A ogads-pa.googleapis.com A 142.250.186.170 A 172.217.16.202 A 216.58.212.138 A 142.250.186.42 A 142.250.185.202 A 172.217.18.10 A 142.250.185.170 A 142.250.186.106 A 142.250.184.202 A 142.250.185.138 A 142.250.186.138 A 142.250.184.234 A 142.250.185.234 A 142.250.186.74 A 172.217.16.138 A 142.250.181.234
129	1.024422911	192.168.9.128	142.250.186.170	TCP	74	52590 → 443 [SYN] Seq=0 Win=64240 Len=0 MSS=1460 SACK_PERM TSval=3877738717 TSecr=0 WS=128
130	1.041711195	192.168.9.128	239.255.255.250	SSDP	209	M-SEARCH * HTTP/1.1 
131	1.077829418	142.250.186.170	192.168.9.128	TCP	60	443 → 52590 [SYN, ACK] Seq=0 Ack=1 Win=64240 Len=0 MSS=1460
132	1.077947294	192.168.9.128	142.250.186.170	TCP	54	52590 → 443 [ACK] Seq=1 Ack=1 Win=64240 Len=0
133	1.078333997	192.168.9.128	142.250.186.170	TLSv1.3	571	Client Hello (SNI=ogads-pa.googleapis.com)
134	1.078663090	142.250.186.170	192.168.9.128	TCP	60	443 → 52590 [ACK] Seq=1 Ack=518 Win=64240 Len=0
135	1.280732538	142.250.186.170	192.168.9.128	TLSv1.3	1454	Server Hello, Change Cipher Spec
136	1.280776185	192.168.9.128	142.250.186.170	TCP	54	52590 → 443 [ACK] Seq=518 Ack=1401 Win=63000 Len=0
137	1.281129814	142.250.186.170	192.168.9.128	TCP	1454	443 → 52590 [PSH, ACK] Seq=1401 Ack=518 Win=64240 Len=1400 [TCP PDU reassembled in 141]
138	1.281180808	192.168.9.128	142.250.186.170	TCP	54	52590 → 443 [ACK] Seq=518 Ack=2801 Win=63000 Len=0
139	1.281394062	142.250.186.170	192.168.9.128	TCP	1514	443 → 52590 [ACK] Seq=2801 Ack=518 Win=64240 Len=1460 [TCP PDU reassembled in 141]
140	1.281421845	192.168.9.128	142.250.186.170	TCP	54	52590 → 443 [ACK] Seq=518 Ack=4261 Win=63000 Len=0
141	1.281475343	142.250.186.170	192.168.9.128	TLSv1.3	459	Application Data
142	1.281680753	192.168.9.128	142.250.186.170	TCP	54	52590 → 443 [ACK] Seq=518 Ack=4666 Win=62595 Len=0
143	1.285555586	192.168.9.128	142.250.186.170	TLSv1.3	128	Change Cipher Spec, Application Data
144	1.286027185	192.168.9.128	142.250.186.170	TLSv1.3	152	Application Data
145	1.286136414	142.250.186.170	192.168.9.128	TCP	60	443 → 52590 [ACK] Seq=4666 Ack=592 Win=64240 Len=0
146	1.286532778	142.250.186.170	192.168.9.128	TCP	60	443 → 52590 [ACK] Seq=4666 Ack=690 Win=64240 Len=0
147	1.286555931	192.168.9.128	142.250.186.170	TLSv1.3	449	Application Data
148	1.286985494	142.250.186.170	192.168.9.128	TCP	60	443 → 52590 [ACK] Seq=4666 Ack=1085 Win=64240 Len=0
149	1.386042981	142.250.186.170	192.168.9.128	TLSv1.3	1028	Application Data, Application Data
150	1.386084450	192.168.9.128	142.250.186.170	TCP	54	52590 → 443 [ACK] Seq=1085 Ack=5640 Win=62780 Len=0
151	1.386302605	192.168.9.128	142.250.186.170	TLSv1.3	85	Application Data
152	1.386493346	142.250.186.170	192.168.9.128	TCP	60	443 → 52590 [ACK] Seq=5640 Ack=1116 Win=64240 Len=0
153	1.454884989	142.250.186.170	192.168.9.128	TLSv1.3	85	Application Data
154	1.454961843	192.168.9.128	142.250.186.170	TCP	54	52590 → 443 [ACK] Seq=1116 Ack=5671 Win=62780 Len=0
155	1.461917676	142.250.186.170	192.168.9.128	TLSv1.3	536	Application Data, Application Data, Application Data
156	1.461949346	192.168.9.128	142.250.186.170	TCP	54	52590 → 443 [ACK] Seq=1116 Ack=6153 Win=62780 Len=0
157	1.465512403	192.168.9.128	142.250.186.170	TLSv1.3	93	Application Data
158	1.465664728	142.250.186.170	192.168.9.128	TCP	60	443 → 52590 [ACK] Seq=6153 Ack=1155 Win=64240 Len=0
159	1.465777775	192.168.9.128	142.250.186.170	TLSv1.3	357	Application Data
160	1.465945872	142.250.186.170	192.168.9.128	TCP	60	443 → 52590 [ACK] Seq=6153 Ack=1458 Win=64240 Len=0
161	1.465958261	192.168.9.128	142.250.186.170	TLSv1.3	152	Application Data
162	1.466411527	142.250.186.170	192.168.9.128	TCP	60	443 → 52590 [ACK] Seq=6153 Ack=1556 Win=64240 Len=0
163	1.687413630	142.250.186.170	192.168.9.128	TLSv1.3	446	Application Data, Application Data, Application Data, Application Data
164	1.690769918	192.168.9.128	142.250.186.170	TLSv1.3	93	Application Data
165	1.691303274	142.250.186.170	192.168.9.128	TCP	60	443 → 52590 [ACK] Seq=6545 Ack=1595 Win=64240 Len=0
166	1.954131479	192.168.9.128	192.168.9.2	DNS	75	Standard query 0xa0ea A play.google.com
167	1.991449001	192.168.9.2	192.168.9.128	DNS	91	Standard query response 0xa0ea A play.google.com A 142.251.36.206
168	1.992245478	192.168.9.128	142.251.36.206	TCP	74	51386 → 443 [SYN] Seq=0 Win=64240 Len=0 MSS=1460 SACK_PERM TSval=2428019323 TSecr=0 WS=128
169	2.045598212	192.168.9.128	239.255.255.250	SSDP	209	M-SEARCH * HTTP/1.1 
170	2.047174858	142.251.36.206	192.168.9.128	TCP	60	443 → 51386 [SYN, ACK] Seq=0 Ack=1 Win=64240 Len=0 MSS=1460
171	2.047306633	192.168.9.128	142.251.36.206	TCP	54	51386 → 443 [ACK] Seq=1 Ack=1 Win=64240 Len=0
172	2.047680289	192.168.9.128	142.251.36.206	TLSv1.2	571	Client Hello (SNI=play.google.com)
173	2.048361331	142.251.36.206	192.168.9.128	TCP	60	443 → 51386 [ACK] Seq=1 Ack=518 Win=64240 Len=0
174	2.987105197	192.168.9.128	224.0.0.251	MDNS	82	Standard query 0x0000 PTR _googlecast._tcp.local, "QM" question
175	3.053346630	192.168.9.128	239.255.255.250	SSDP	209	M-SEARCH * HTTP/1.1 
176	3.989008959	192.168.9.128	224.0.0.251	MDNS	82	Standard query 0x0000 PTR _googlecast._tcp.local, "QM" question
177	5.997553590	192.168.9.128	224.0.0.251	MDNS	82	Standard query 0x0000 PTR _googlecast._tcp.local, "QM" question
178	7.718995454	192.168.9.128	216.239.38.120	TLSv1.3	199	Application Data
179	7.719573781	192.168.9.128	216.239.38.120	TLSv1.3	212	Application Data
180	7.719691489	216.239.38.120	192.168.9.128	TCP	60	443 → 41722 [ACK] Seq=44785 Ack=1940 Win=64240 Len=0
181	7.719708883	216.239.38.120	192.168.9.128	TCP	60	443 → 41722 [ACK] Seq=44785 Ack=2098 Win=64240 Len=0
182	7.923623664	216.239.38.120	192.168.9.128	TLSv1.3	523	Application Data, Application Data, Application Data, Application Data, Application Data
183	7.923667047	192.168.9.128	216.239.38.120	TCP	54	41722 → 443 [ACK] Seq=2098 Ack=45254 Win=62780 Len=0
184	7.926844911	192.168.9.128	216.239.38.120	TLSv1.3	89	Application Data
185	7.927006077	192.168.9.128	216.239.38.120	TLSv1.3	93	Application Data
186	7.927189754	216.239.38.120	192.168.9.128	TCP	60	443 → 41722 [ACK] Seq=45254 Ack=2133 Win=64240 Len=0
187	7.927207212	216.239.38.120	192.168.9.128	TCP	60	443 → 41722 [ACK] Seq=45254 Ack=2172 Win=64240 Len=0
188	8.013727613	216.239.38.120	192.168.9.128	TLSv1.3	484	Application Data, Application Data, Application Data, Application Data
189	8.013769808	192.168.9.128	216.239.38.120	TCP	54	41722 → 443 [ACK] Seq=2172 Ack=45684 Win=62780 Len=0
190	13.064442397	192.168.9.128	192.168.9.2	DNS	95	Standard query 0x6485 A optimizationguide-pa.googleapis.com
191	13.102486665	192.168.9.2	192.168.9.128	DNS	271	Standard query response 0x6485 A optimizationguide-pa.googleapis.com A 142.250.181.138 A 172.217.17.74 A 142.250.181.74 A 172.217.19.234 A 172.217.19.170 A 172.217.21.42 A 216.58.208.234 A 142.250.181.10 A 172.217.19.202 A 172.217.17.42 A 142.250.181.106
192	13.104235471	192.168.9.128	142.250.181.138	TCP	74	47686 → 443 [SYN] Seq=0 Win=64240 Len=0 MSS=1460 SACK_PERM TSval=571864529 TSecr=0 WS=128
193	13.156591013	142.250.181.138	192.168.9.128	TCP	60	443 → 47686 [SYN, ACK] Seq=0 Ack=1 Win=64240 Len=0 MSS=1460
194	13.156710985	192.168.9.128	142.250.181.138	TCP	54	47686 → 443 [ACK] Seq=1 Ack=1 Win=64240 Len=0
195	13.157176323	192.168.9.128	142.250.181.138	TLSv1.3	571	Client Hello (SNI=optimizationguide-pa.googleapis.com)
196	13.157945516	142.250.181.138	192.168.9.128	TCP	60	443 → 47686 [ACK] Seq=1 Ack=518 Win=64240 Len=0
197	13.352192021	142.250.181.138	192.168.9.128	TLSv1.3	1454	Server Hello, Change Cipher Spec
198	13.352221425	192.168.9.128	142.250.181.138	TCP	54	47686 → 443 [ACK] Seq=518 Ack=1401 Win=63000 Len=0
199	13.352983677	142.250.181.138	192.168.9.128	TCP	1454	443 → 47686 [PSH, ACK] Seq=1401 Ack=518 Win=64240 Len=1400 [TCP PDU reassembled in 203]
200	13.352997637	192.168.9.128	142.250.181.138	TCP	54	47686 → 443 [ACK] Seq=518 Ack=2801 Win=63000 Len=0
201	13.355155684	142.250.181.138	192.168.9.128	TCP	1514	443 → 47686 [ACK] Seq=2801 Ack=518 Win=64240 Len=1460 [TCP PDU reassembled in 203]
202	13.355180839	192.168.9.128	142.250.181.138	TCP	54	47686 → 443 [ACK] Seq=518 Ack=4261 Win=63000 Len=0
203	13.355252008	142.250.181.138	192.168.9.128	TLSv1.3	473	Application Data
204	13.355261546	192.168.9.128	142.250.181.138	TCP	54	47686 → 443 [ACK] Seq=518 Ack=4680 Win=63000 Len=0
205	13.359772636	192.168.9.128	142.250.181.138	TLSv1.3	128	Change Cipher Spec, Application Data
206	13.360261799	142.250.181.138	192.168.9.128	TCP	60	443 → 47686 [ACK] Seq=4680 Ack=592 Win=64240 Len=0
207	13.360504361	192.168.9.128	142.250.181.138	TLSv1.3	152	Application Data
208	13.360802304	192.168.9.128	142.250.181.138	TLSv1.3	365	Application Data
209	13.360954066	192.168.9.128	142.250.181.138	TLSv1.3	530	Application Data
210	13.361050583	142.250.181.138	192.168.9.128	TCP	60	443 → 47686 [ACK] Seq=4680 Ack=690 Win=64240 Len=0
211	13.361057092	142.250.181.138	192.168.9.128	TCP	60	443 → 47686 [ACK] Seq=4680 Ack=1001 Win=64240 Len=0
212	13.361058244	142.250.181.138	192.168.9.128	TCP	60	443 → 47686 [ACK] Seq=4680 Ack=1477 Win=64240 Len=0
213	13.426540550	142.250.181.138	192.168.9.128	TLSv1.3	1052	Application Data, Application Data
214	13.426594339	192.168.9.128	142.250.181.138	TCP	54	47686 → 443 [ACK] Seq=1477 Ack=5678 Win=63000 Len=0
215	13.427069150	192.168.9.128	142.250.181.138	TLSv1.3	85	Application Data
216	13.427828761	142.250.181.138	192.168.9.128	TCP	60	443 → 47686 [ACK] Seq=5678 Ack=1508 Win=64240 Len=0
217	13.489409728	142.250.181.138	192.168.9.128	TLSv1.3	85	Application Data
218	13.489465190	192.168.9.128	142.250.181.138	TCP	54	47686 → 443 [ACK] Seq=1508 Ack=5709 Win=63000 Len=0
219	13.602903702	142.250.181.138	192.168.9.128	TLSv1.3	787	Application Data, Application Data, Application Data, Application Data
220	13.602957860	192.168.9.128	142.250.181.138	TCP	54	47686 → 443 [ACK] Seq=1508 Ack=6442 Win=63000 Len=0
221	13.605542242	192.168.9.128	142.250.181.138	TLSv1.3	93	Application Data
222	13.605826207	142.250.181.138	192.168.9.128	TCP	60	443 → 47686 [ACK] Seq=6442 Ack=1547 Win=64240 Len=0
223	20.873068798	142.251.36.206	192.168.9.128	TCP	60	443 → 51386 [RST, ACK] Seq=1 Ack=518 Win=64240 Len=0
224	20.874057030	192.168.9.128	142.251.36.206	TCP	74	40612 → 443 [SYN] Seq=0 Win=64240 Len=0 MSS=1460 SACK_PERM TSval=2428038205 TSecr=0 WS=128
225	20.997003501	142.251.36.206	192.168.9.128	TCP	60	443 → 40612 [SYN, ACK] Seq=0 Ack=1 Win=64240 Len=0 MSS=1460
226	20.997101791	192.168.9.128	142.251.36.206	TCP	54	40612 → 443 [ACK] Seq=1 Ack=1 Win=64240 Len=0
227	20.997458022	192.168.9.128	142.251.36.206	TLSv1.2	571	Client Hello (SNI=play.google.com)
228	20.997712473	142.251.36.206	192.168.9.128	TCP	60	443 → 40612 [ACK] Seq=1 Ack=518 Win=64240 Len=0
229	29.546623051	192.168.9.128	192.168.9.2	DNS	78	Standard query 0x8ece A www.googleapis.com
230	29.602695316	192.168.9.2	192.168.9.128	DNS	334	Standard query response 0x8ece A www.googleapis.com A 142.250.185.234 A 142.250.185.170 A 142.250.186.138 A 142.250.185.74 A 216.58.206.74 A 142.250.185.138 A 142.250.186.42 A 172.217.23.106 A 142.250.184.202 A 142.250.181.234 A 142.250.185.202 A 142.250.186.74 A 142.250.186.170 A 172.217.18.106 A 216.58.212.170 A 216.58.212.138
231	29.603623513	192.168.9.128	142.250.186.170	TLSv1.3	240	Application Data
232	29.603960389	142.250.186.170	192.168.9.128	TCP	60	443 → 52590 [ACK] Seq=6545 Ack=1781 Win=64240 Len=0
233	29.604021162	192.168.9.128	142.250.186.170	TLSv1.3	93	Application Data
234	29.604106952	142.250.186.170	192.168.9.128	TCP	60	443 → 52590 [ACK] Seq=6545 Ack=1820 Win=64240 Len=0
235	29.604133322	192.168.9.128	142.250.186.170	TLSv1.3	109	Application Data
236	29.604366556	142.250.186.170	192.168.9.128	TCP	60	443 → 52590 [ACK] Seq=6545 Ack=1875 Win=64240 Len=0
237	29.757297123	142.250.186.170	192.168.9.128	TLSv1.3	93	Application Data
238	29.798611871	142.250.186.170	192.168.9.128	TLSv1.3	935	Application Data, Application Data, Application Data, Application Data
239	29.798666514	192.168.9.128	142.250.186.170	TCP	54	52590 → 443 [ACK] Seq=1875 Ack=7465 Win=62780 Len=0
240	29.801167281	192.168.9.128	142.250.186.170	TLSv1.3	89	Application Data
241	29.801584967	142.250.186.170	192.168.9.128	TCP	60	443 → 52590 [ACK] Seq=7465 Ack=1910 Win=64240 Len=0
242	29.801762078	192.168.9.128	142.250.186.170	TLSv1.3	93	Application Data
243	29.802091283	142.250.186.170	192.168.9.128	TCP	60	443 → 52590 [ACK] Seq=7465 Ack=1949 Win=64240 Len=0
244	29.982497643	VMware_c0:00:08	Broadcast	ARP	60	Who has 192.168.9.2? Tell 192.168.9.1
245	31.478768419	VMware_c0:00:08	Broadcast	ARP	60	Who has 192.168.9.2? Tell 192.168.9.1
246	32.477275683	VMware_c0:00:08	Broadcast	ARP	60	Who has 192.168.9.2? Tell 192.168.9.1
247	33.475916579	VMware_c0:00:08	Broadcast	ARP	60	Who has 192.168.9.2? Tell 192.168.9.1
248	34.504130686	VMware_c0:00:08	Broadcast	ARP	60	Who has 192.168.9.2? Tell 192.168.9.1
249	35.485302267	VMware_c0:00:08	Broadcast	ARP	60	Who has 192.168.9.2? Tell 192.168.9.1
250	36.483035789	VMware_c0:00:08	Broadcast	ARP	60	Who has 192.168.9.2? Tell 192.168.9.1
251	37.527263061	VMware_c0:00:08	Broadcast	ARP	60	Who has 192.168.9.2? Tell 192.168.9.1
252	38.480274425	VMware_c0:00:08	Broadcast	ARP	60	Who has 192.168.9.2? Tell 192.168.9.1
253	38.735697821	192.168.9.128	142.250.186.170	TLSv1.3	174	Application Data
254	38.735918707	192.168.9.128	142.250.186.170	TLSv1.3	109	Application Data
255	38.736054300	142.250.186.170	192.168.9.128	TCP	60	443 → 52590 [ACK] Seq=7465 Ack=2069 Win=64240 Len=0
256	38.736067464	142.250.186.170	192.168.9.128	TCP	60	443 → 52590 [ACK] Seq=7465 Ack=2124 Win=64240 Len=0
257	38.940425693	142.250.186.170	192.168.9.128	TLSv1.3	781	Application Data, Application Data, Application Data, Application Data
258	38.942661019	192.168.9.128	142.250.186.170	TLSv1.3	89	Application Data
259	38.942793422	192.168.9.128	142.250.186.170	TLSv1.3	93	Application Data
260	38.942989600	142.250.186.170	192.168.9.128	TCP	60	443 → 52590 [ACK] Seq=8192 Ack=2159 Win=64240 Len=0
261	38.943010021	142.250.186.170	192.168.9.128	TCP	60	443 → 52590 [ACK] Seq=8192 Ack=2198 Win=64240 Len=0
262	39.489213924	VMware_c0:00:08	Broadcast	ARP	60	Who has 192.168.9.2? Tell 192.168.9.1
263	40.545098108	VMware_c0:00:08	Broadcast	ARP	60	Who has 192.168.9.2? Tell 192.168.9.1
264	41.485669584	VMware_c0:00:08	Broadcast	ARP	60	Who has 192.168.9.2? Tell 192.168.9.1
265	42.482403430	VMware_c0:00:08	Broadcast	ARP	60	Who has 192.168.9.2? Tell 192.168.9.1
266	44.557254912	142.251.36.206	192.168.9.128	TCP	60	443 → 40612 [RST, ACK] Seq=1 Ack=518 Win=64240 Len=0
267	46.730211944	192.168.9.128	142.251.36.206	TCP	74	49602 → 443 [SYN] Seq=0 Win=64240 Len=0 MSS=1460 SACK_PERM TSval=2428064061 TSecr=0 WS=128
268	46.740458698	192.168.9.128	142.251.5.84	TCP	54	[TCP Keep-Alive] 34824 → 443 [ACK] Seq=591 Ack=3966 Win=63000 Len=0
269	46.740565351	192.168.9.128	142.251.5.84	TCP	54	[TCP Keep-Alive] 34818 → 443 [ACK] Seq=1549 Ack=5641 Win=63000 Len=0
270	46.866261028	142.251.36.206	192.168.9.128	TCP	60	443 → 49602 [SYN, ACK] Seq=0 Ack=1 Win=64240 Len=0 MSS=1460
271	46.866447001	192.168.9.128	142.251.36.206	TCP	54	49602 → 443 [ACK] Seq=1 Ack=1 Win=64240 Len=0
272	46.867481090	192.168.9.128	142.251.36.206	TLSv1.2	571	Client Hello (SNI=play.google.com)
273	46.867964333	142.251.36.206	192.168.9.128	TCP	60	443 → 49602 [ACK] Seq=1 Ack=518 Win=64240 Len=0
274	53.140518709	192.168.9.128	216.239.38.120	TCP	54	[TCP Keep-Alive] 41722 → 443 [ACK] Seq=2171 Ack=45684 Win=62780 Len=0
275	53.227400870	192.168.9.128	192.168.9.2	DNS	70	Standard query 0x9421 A iust.ac.ir
276	53.263254946	192.168.9.2	192.168.9.128	DNS	86	Standard query response 0x9421 A iust.ac.ir A 194.225.228.111
277	53.265188874	192.168.9.128	192.168.9.2	DNS	70	Standard query 0x9e56 AAAA iust.ac.ir
278	53.306358965	192.168.9.2	192.168.9.128	DNS	120	Standard query response 0x9e56 AAAA iust.ac.ir SOA jupitr.iust.ac.ir
279	59.028612040	192.168.9.128	142.250.181.138	TCP	54	[TCP Keep-Alive] 47686 → 443 [ACK] Seq=1546 Ack=6442 Win=63000 Len=0
280	60.000014161	192.168.9.128	192.168.9.2	DNS	81	Standard query 0xfe22 A update.googleapis.com
281	60.045825795	192.168.9.2	192.168.9.128	DNS	97	Standard query response 0xfe22 A update.googleapis.com A 172.217.17.67
282	60.046717906	192.168.9.128	172.217.17.67	TCP	74	44834 → 443 [SYN] Seq=0 Win=64240 Len=0 MSS=1460 SACK_PERM TSval=2341158303 TSecr=0 WS=128
283	60.097152594	172.217.17.67	192.168.9.128	TCP	60	443 → 44834 [SYN, ACK] Seq=0 Ack=1 Win=64240 Len=0 MSS=1460
284	60.097239343	192.168.9.128	172.217.17.67	TCP	54	44834 → 443 [ACK] Seq=1 Ack=1 Win=64240 Len=0
285	60.098153608	192.168.9.128	172.217.17.67	TLSv1.3	571	Client Hello (SNI=update.googleapis.com)
286	60.098512008	172.217.17.67	192.168.9.128	TCP	60	443 → 44834 [ACK] Seq=1 Ack=518 Win=64240 Len=0
287	60.318835902	172.217.17.67	192.168.9.128	TLSv1.3	1514	Server Hello, Change Cipher Spec
288	60.318900018	192.168.9.128	172.217.17.67	TCP	54	44834 → 443 [ACK] Seq=518 Ack=1461 Win=62780 Len=0
289	60.319123095	172.217.17.67	192.168.9.128	TCP	1514	443 → 44834 [ACK] Seq=1461 Ack=518 Win=64240 Len=1460 [TCP PDU reassembled in 293]
290	60.319141438	192.168.9.128	172.217.17.67	TCP	54	44834 → 443 [ACK] Seq=518 Ack=2921 Win=62780 Len=0
291	60.319210706	172.217.17.67	192.168.9.128	TCP	1514	443 → 44834 [ACK] Seq=2921 Ack=518 Win=64240 Len=1460 [TCP PDU reassembled in 293]
292	60.319215511	192.168.9.128	172.217.17.67	TCP	54	44834 → 443 [ACK] Seq=518 Ack=4381 Win=61320 Len=0
293	60.319232912	172.217.17.67	192.168.9.128	TLSv1.3	338	Application Data
294	60.319236445	192.168.9.128	172.217.17.67	TCP	54	44834 → 443 [ACK] Seq=518 Ack=4665 Win=61320 Len=0
295	60.325519971	192.168.9.128	172.217.17.67	TLSv1.3	128	Change Cipher Spec, Application Data
296	60.326026194	172.217.17.67	192.168.9.128	TCP	60	443 → 44834 [ACK] Seq=4665 Ack=592 Win=64240 Len=0
297	60.326195197	192.168.9.128	172.217.17.67	TLSv1.3	152	Application Data
298	60.326567601	192.168.9.128	172.217.17.67	TLSv1.3	872	Application Data
299	60.326731962	172.217.17.67	192.168.9.128	TCP	60	443 → 44834 [ACK] Seq=4665 Ack=690 Win=64240 Len=0
300	60.326912921	172.217.17.67	192.168.9.128	TCP	60	443 → 44834 [ACK] Seq=4665 Ack=1508 Win=64240 Len=0
301	60.327033865	192.168.9.128	172.217.17.67	TCP	1514	44834 → 443 [ACK] Seq=1508 Ack=4665 Win=62780 Len=1460 [TCP PDU reassembled in 309]
302	60.327181788	192.168.9.128	172.217.17.67	TCP	1514	44834 → 443 [PSH, ACK] Seq=2968 Ack=4665 Win=62780 Len=1460 [TCP PDU reassembled in 309]
303	60.327364001	172.217.17.67	192.168.9.128	TCP	60	443 → 44834 [ACK] Seq=4665 Ack=2968 Win=64240 Len=0
304	60.327367734	172.217.17.67	192.168.9.128	TCP	60	443 → 44834 [ACK] Seq=4665 Ack=4428 Win=64240 Len=0
305	60.327576853	192.168.9.128	172.217.17.67	TCP	1514	44834 → 443 [ACK] Seq=4428 Ack=4665 Win=62780 Len=1460 [TCP PDU reassembled in 309]
306	60.327898917	192.168.9.128	172.217.17.67	TCP	1514	44834 → 443 [PSH, ACK] Seq=5888 Ack=4665 Win=62780 Len=1460 [TCP PDU reassembled in 309]
307	60.328060609	172.217.17.67	192.168.9.128	TCP	60	443 → 44834 [ACK] Seq=4665 Ack=5888 Win=64240 Len=0
308	60.328324447	172.217.17.67	192.168.9.128	TCP	60	443 → 44834 [ACK] Seq=4665 Ack=7348 Win=64240 Len=0
309	60.328394286	192.168.9.128	172.217.17.67	TLSv1.3	835	Application Data
310	60.328575964	172.217.17.67	192.168.9.128	TCP	60	443 → 44834 [ACK] Seq=4665 Ack=8129 Win=64240 Len=0
311	60.393392578	172.217.17.67	192.168.9.128	TLSv1.3	1024	Application Data, Application Data
312	60.393445975	192.168.9.128	172.217.17.67	TCP	54	44834 → 443 [ACK] Seq=8129 Ack=5635 Win=62780 Len=0
313	60.393969144	192.168.9.128	172.217.17.67	TLSv1.3	85	Application Data
314	60.394517442	172.217.17.67	192.168.9.128	TCP	60	443 → 44834 [ACK] Seq=5635 Ack=8160 Win=64240 Len=0
315	60.401018838	172.217.17.67	192.168.9.128	TLSv1.3	85	Application Data
316	60.401047481	192.168.9.128	172.217.17.67	TCP	54	44834 → 443 [ACK] Seq=8160 Ack=5666 Win=62780 Len=0
317	60.555311263	172.217.17.67	192.168.9.128	TLSv1.3	855	Application Data
318	60.555362583	192.168.9.128	172.217.17.67	TCP	54	44834 → 443 [ACK] Seq=8160 Ack=6467 Win=62780 Len=0
319	60.558272719	172.217.17.67	192.168.9.128	TLSv1.3	1421	Application Data
320	60.558398112	192.168.9.128	172.217.17.67	TCP	54	44834 → 443 [ACK] Seq=8160 Ack=7834 Win=62780 Len=0
321	60.560115884	172.217.17.67	192.168.9.128	TLSv1.3	124	Application Data, Application Data
322	60.560275794	192.168.9.128	172.217.17.67	TCP	54	44834 → 443 [ACK] Seq=8160 Ack=7904 Win=62780 Len=0
323	60.561066032	192.168.9.128	172.217.17.67	TLSv1.3	93	Application Data
324	60.561430009	172.217.17.67	192.168.9.128	TCP	60	443 → 44834 [ACK] Seq=7904 Ack=8199 Win=64240 Len=0
325	60.565320896	192.168.9.128	192.168.9.2	DNS	78	Standard query 0xad79 A edgedl.me.gvt1.com
326	60.602013008	192.168.9.2	192.168.9.128	DNS	94	Standard query response 0xad79 A edgedl.me.gvt1.com A 34.104.35.123
327	60.602955605	192.168.9.128	34.104.35.123	TCP	74	36356 → 80 [SYN] Seq=0 Win=64240 Len=0 MSS=1460 SACK_PERM TSval=4211024738 TSecr=0 WS=128
328	60.700819937	34.104.35.123	192.168.9.128	TCP	60	80 → 36356 [SYN, ACK] Seq=0 Ack=1 Win=64240 Len=0 MSS=1460
329	60.700916979	192.168.9.128	34.104.35.123	TCP	54	36356 → 80 [ACK] Seq=1 Ack=1 Win=64240 Len=0
330	60.701737887	192.168.9.128	34.104.35.123	HTTP	417	GET /edgedl/chromewebstore/L2Nocm9tZV9leHRlbnNpb24vYmxvYnMvYjhkYWYwZDctOTExOS00MGQ5LTgyNjAtN2FlY2ZjMDg0NmNj/1.0.0.17_llkgjffcdpffmhiakmfcdcblohccpfmo.crx HTTP/1.1 
331	60.702410142	34.104.35.123	192.168.9.128	TCP	60	80 → 36356 [ACK] Seq=1 Ack=364 Win=64240 Len=0
332	64.599066224	192.168.9.128	192.168.9.2	DNS	74	Standard query 0x5c79 A www.google.com
333	64.640533531	192.168.9.2	192.168.9.128	DNS	90	Standard query response 0x5c79 A www.google.com A 216.239.38.120
334	67.242219088	192.168.9.128	216.239.38.120	TLSv1.3	199	Application Data
335	67.242479015	216.239.38.120	192.168.9.128	TCP	60	443 → 41722 [ACK] Seq=45684 Ack=2317 Win=64240 Len=0
336	67.242593548	192.168.9.128	216.239.38.120	TLSv1.3	93	Application Data
337	67.242800680	192.168.9.128	216.239.38.120	TLSv1.3	212	Application Data
338	67.242969307	216.239.38.120	192.168.9.128	TCP	60	443 → 41722 [ACK] Seq=45684 Ack=2356 Win=64240 Len=0
339	67.242978942	216.239.38.120	192.168.9.128	TCP	60	443 → 41722 [ACK] Seq=45684 Ack=2514 Win=64240 Len=0
340	67.386134164	216.239.38.120	192.168.9.128	TLSv1.3	93	Application Data
341	67.386319589	192.168.9.128	216.239.38.120	TCP	54	41722 → 443 [ACK] Seq=2514 Ack=45723 Win=62780 Len=0
342	67.447734486	216.239.38.120	192.168.9.128	TLSv1.3	420	Application Data, Application Data
343	67.447787250	192.168.9.128	216.239.38.120	TCP	54	41722 → 443 [ACK] Seq=2514 Ack=46089 Win=62780 Len=0
344	67.450024885	216.239.38.120	192.168.9.128	TLSv1.3	156	Application Data, Application Data, Application Data
345	67.450061212	192.168.9.128	216.239.38.120	TCP	54	41722 → 443 [ACK] Seq=2514 Ack=46191 Win=62780 Len=0
346	67.450653611	192.168.9.128	216.239.38.120	TLSv1.3	89	Application Data
347	67.450857807	192.168.9.128	216.239.38.120	TLSv1.3	93	Application Data
348	67.451182380	216.239.38.120	192.168.9.128	TCP	60	443 → 41722 [ACK] Seq=46191 Ack=2549 Win=64240 Len=0
349	67.451207490	216.239.38.120	192.168.9.128	TCP	60	443 → 41722 [ACK] Seq=46191 Ack=2588 Win=64240 Len=0
350	67.540480230	216.239.38.120	192.168.9.128	TLSv1.3	420	Application Data, Application Data
351	67.540519745	192.168.9.128	216.239.38.120	TCP	54	41722 → 443 [ACK] Seq=2588 Ack=46557 Win=62780 Len=0
352	67.542319220	216.239.38.120	192.168.9.128	TLSv1.3	117	Application Data, Application Data
353	67.542346091	192.168.9.128	216.239.38.120	TCP	54	41722 → 443 [ACK] Seq=2588 Ack=46620 Win=62780 Len=0
354	68.230343567	192.168.9.128	216.239.38.120	TLSv1.3	225	Application Data
355	68.231067992	216.239.38.120	192.168.9.128	TCP	60	443 → 41722 [ACK] Seq=46620 Ack=2759 Win=64240 Len=0
356	68.342943728	192.168.9.128	216.239.38.120	TLSv1.3	89	Application Data
357	68.343584906	216.239.38.120	192.168.9.128	TCP	60	443 → 41722 [ACK] Seq=46620 Ack=2794 Win=64240 Len=0
358	68.343606338	192.168.9.128	216.239.38.120	TLSv1.3	226	Application Data
359	68.344003355	216.239.38.120	192.168.9.128	TCP	60	443 → 41722 [ACK] Seq=46620 Ack=2966 Win=64240 Len=0
360	68.432079690	192.168.9.128	216.239.38.120	TLSv1.3	89	Application Data
361	68.432536280	216.239.38.120	192.168.9.128	TCP	60	443 → 41722 [ACK] Seq=46620 Ack=3001 Win=64240 Len=0
362	68.443269971	192.168.9.128	216.239.38.120	TLSv1.3	227	Application Data
363	68.443529092	216.239.38.120	192.168.9.128	TCP	60	443 → 41722 [ACK] Seq=46620 Ack=3174 Win=64240 Len=0
364	68.589937937	192.168.9.128	216.239.38.120	TLSv1.3	89	Application Data
365	68.590361690	216.239.38.120	192.168.9.128	TCP	60	443 → 41722 [ACK] Seq=46620 Ack=3209 Win=64240 Len=0
366	68.590370121	192.168.9.128	216.239.38.120	TLSv1.3	227	Application Data
367	68.590751016	216.239.38.120	192.168.9.128	TCP	60	443 → 41722 [ACK] Seq=46620 Ack=3382 Win=64240 Len=0
368	68.827512330	216.239.38.120	192.168.9.128	TLSv1.3	584	Application Data, Application Data
369	68.827618886	192.168.9.128	216.239.38.120	TCP	54	41722 → 443 [ACK] Seq=3382 Ack=47150 Win=62780 Len=0
370	68.831043428	216.239.38.120	192.168.9.128	TLSv1.3	156	Application Data, Application Data, Application Data
371	68.831073272	192.168.9.128	216.239.38.120	TCP	54	41722 → 443 [ACK] Seq=3382 Ack=47252 Win=62780 Len=0
372	68.832027290	192.168.9.128	216.239.38.120	TLSv1.3	93	Application Data
373	68.832352149	216.239.38.120	192.168.9.128	TCP	60	443 → 41722 [ACK] Seq=47252 Ack=3421 Win=64240 Len=0
374	68.882178374	192.168.9.128	216.239.38.120	TLSv1.3	228	Application Data
375	68.882503450	216.239.38.120	192.168.9.128	TCP	60	443 → 41722 [ACK] Seq=47252 Ack=3595 Win=64240 Len=0
376	69.123087359	216.239.38.120	192.168.9.128	TLSv1.3	580	Application Data, Application Data
377	69.124895358	216.239.38.120	192.168.9.128	TLSv1.3	156	Application Data, Application Data, Application Data
378	69.124959067	192.168.9.128	216.239.38.120	TCP	54	41722 → 443 [ACK] Seq=3595 Ack=47880 Win=62780 Len=0
379	69.127077270	192.168.9.128	216.239.38.120	TLSv1.3	93	Application Data
380	69.127297968	216.239.38.120	192.168.9.128	TCP	60	443 → 41722 [ACK] Seq=47880 Ack=3634 Win=64240 Len=0
381	69.127618432	192.168.9.128	216.239.38.120	TLSv1.3	229	Application Data
382	69.127833761	216.239.38.120	192.168.9.128	TCP	60	443 → 41722 [ACK] Seq=47880 Ack=3809 Win=64240 Len=0
383	69.196920593	192.168.9.128	216.239.38.120	TLSv1.3	89	Application Data
384	69.197663181	216.239.38.120	192.168.9.128	TCP	60	443 → 41722 [ACK] Seq=47880 Ack=3844 Win=64240 Len=0
385	69.230247699	192.168.9.128	216.239.38.120	TLSv1.3	229	Application Data
386	69.230691413	216.239.38.120	192.168.9.128	TCP	60	443 → 41722 [ACK] Seq=47880 Ack=4019 Win=64240 Len=0
387	69.469193462	192.168.9.128	216.239.38.120	TLSv1.3	89	Application Data
388	69.469785510	216.239.38.120	192.168.9.128	TCP	60	443 → 41722 [ACK] Seq=47880 Ack=4054 Win=64240 Len=0
389	69.470147322	192.168.9.128	216.239.38.120	TLSv1.3	231	Application Data
390	69.470509610	216.239.38.120	192.168.9.128	TCP	60	443 → 41722 [ACK] Seq=47880 Ack=4231 Win=64240 Len=0
391	69.512164217	216.239.38.120	192.168.9.128	TLSv1.3	648	Application Data, Application Data, Application Data, Application Data, Application Data
392	69.512406772	192.168.9.128	216.239.38.120	TLSv1.3	93	Application Data
393	69.512563614	216.239.38.120	192.168.9.128	TCP	60	443 → 41722 [ACK] Seq=48474 Ack=4270 Win=64240 Len=0
394	69.580617682	192.168.9.128	216.239.38.120	TLSv1.3	89	Application Data
395	69.580930985	216.239.38.120	192.168.9.128	TCP	60	443 → 41722 [ACK] Seq=48474 Ack=4305 Win=64240 Len=0
396	69.581441359	192.168.9.128	216.239.38.120	TLSv1.3	232	Application Data
